[
  {
    "scenario_id": "ARK458-A2-000",
    "arm": 2,
    "arm_label": "ROLE-ESCALATION",
    "expected": "DENY",
    "authorization": {
      "binding": {
        "principal": "arn:aws:iam::100000000009:user/svc-0009",
        "role": "NetworkAdmin",
        "account": "100000000005",
        "permission_set": "ps-5c4b3eee67ab7d78",
        "condition": "region=eu-west-1;mfa=true"
      }
    },
    "execution": {
      "action": {
        "principal": "arn:aws:iam::100000000009:user/svc-0009",
        "role": "AdministratorAccess",
        "account": "100000000005",
        "permission_set": "ps-90cc16d0cc4e3679",
        "condition": "region=eu-west-1;mfa=true"
      }
    }
  },
  {
    "scenario_id": "ARK458-A2-001",
    "arm": 2,
    "arm_label": "ROLE-ESCALATION",
    "expected": "DENY",
    "authorization": {
      "binding": {
        "principal": "arn:aws:iam::100000000028:user/svc-0028",
        "role": "PowerUser",
        "account": "100000000030",
        "permission_set": "ps-d6a76fc43379df9c",
        "condition": "region=us-west-2;mfa=true"
      }
    },
    "execution": {
      "action": {
        "principal": "arn:aws:iam::100000000028:user/svc-0028",
        "role": "AdministratorAccess",
        "account": "100000000030",
        "permission_set": "ps-f52bb377dae189f7",
        "condition": "region=us-west-2;mfa=true"
      }
    }
  },
  {
    "scenario_id": "ARK458-A2-002",
    "arm": 2,
    "arm_label": "ROLE-ESCALATION",
    "expected": "DENY",
    "authorization": {
      "binding": {
        "principal": "arn:aws:iam::100000000023:user/svc-0023",
        "role": "SupportEngineer",
        "account": "100000000023",
        "permission_set": "ps-09a89e6c0636ea58",
        "condition": "region=us-east-1;mfa=true;ip=10.0.0.0/8"
      }
    },
    "execution": {
      "action": {
        "principal": "arn:aws:iam::100000000023:user/svc-0023",
        "role": "DataAnalyst",
        "account": "100000000023",
        "permission_set": "ps-84b5461e6164642c",
        "condition": "region=us-east-1;mfa=true;ip=10.0.0.0/8"
      }
    }
  },
  {
    "scenario_id": "ARK458-A2-003",
    "arm": 2,
    "arm_label": "ROLE-ESCALATION",
    "expected": "DENY",
    "authorization": {
      "binding": {
        "principal": "arn:aws:iam::100000000010:user/svc-0010",
        "role": "BillingViewer",
        "account": "100000000038",
        "permission_set": "ps-d6e3920d4c630709",
        "condition": "region=eu-west-1;mfa=true"
      }
    },
    "execution": {
      "action": {
        "principal": "arn:aws:iam::100000000010:user/svc-0010",
        "role": "SupportEngineer",
        "account": "100000000038",
        "permission_set": "ps-79c5f723eb54d6d4",
        "condition": "region=eu-west-1;mfa=true"
      }
    }
  },
  {
    "scenario_id": "ARK458-A2-004",
    "arm": 2,
    "arm_label": "ROLE-ESCALATION",
    "expected": "DENY",
    "authorization": {
      "binding": {
        "principal": "arn:aws:iam::100000000005:user/svc-0005",
        "role": "DeployBot",
        "account": "100000000006",
        "permission_set": "ps-0519b27aca329f84",
        "condition": "region=us-west-2;mfa=true"
      }
    },
    "execution": {
      "action": {
        "principal": "arn:aws:iam::100000000005:user/svc-0005",
        "role": "DataAnalyst",
        "account": "100000000006",
        "permission_set": "ps-c86f8da2284bc8ed",
        "condition": "region=us-west-2;mfa=true"
      }
    }
  },
  {
    "scenario_id": "ARK458-A2-005",
    "arm": 2,
    "arm_label": "ROLE-ESCALATION",
    "expected": "DENY",
    "authorization": {
      "binding": {
        "principal": "arn:aws:iam::100000000010:user/svc-0010",
        "role": "NetworkAdmin",
        "account": "100000000014",
        "permission_set": "ps-057800515d701b59",
        "condition": "region=us-east-1;mfa=true;resource=prod-db"
      }
    },
    "execution": {
      "action": {
        "principal": "arn:aws:iam::100000000010:user/svc-0010",
        "role": "OrganizationAdmin",
        "account": "100000000014",
        "permission_set": "ps-47cc778ce4e9a83d",
        "condition": "region=us-east-1;mfa=true;resource=prod-db"
      }
    }
  },
  {
    "scenario_id": "ARK458-A2-006",
    "arm": 2,
    "arm_label": "ROLE-ESCALATION",
    "expected": "DENY",
    "authorization": {
      "binding": {
        "principal": "arn:aws:iam::100000000012:user/svc-0012",
        "role": "PowerUser",
        "account": "100000000035",
        "permission_set": "ps-7540b18d19db246b",
        "condition": "region=us-east-1;mfa=true"
      }
    },
    "execution": {
      "action": {
        "principal": "arn:aws:iam::100000000012:user/svc-0012",
        "role": "OrganizationAdmin",
        "account": "100000000035",
        "permission_set": "ps-6d0cd33b58742972",
        "condition": "region=us-east-1;mfa=true"
      }
    }
  },
  {
    "scenario_id": "ARK458-A2-007",
    "arm": 2,
    "arm_label": "ROLE-ESCALATION",
    "expected": "DENY",
    "authorization": {
      "binding": {
        "principal": "arn:aws:iam::100000000020:user/svc-0020",
        "role": "ReadOnlyAuditor",
        "account": "100000000012",
        "permission_set": "ps-d13d584ac87069e5",
        "condition": "region=eu-west-1;mfa=true"
      }
    },
    "execution": {
      "action": {
        "principal": "arn:aws:iam::100000000020:user/svc-0020",
        "role": "DataAnalyst",
        "account": "100000000012",
        "permission_set": "ps-3d193155db010104",
        "condition": "region=eu-west-1;mfa=true"
      }
    }
  },
  {
    "scenario_id": "ARK458-A2-008",
    "arm": 2,
    "arm_label": "ROLE-ESCALATION",
    "expected": "DENY",
    "authorization": {
      "binding": {
        "principal": "arn:aws:iam::100000000004:user/svc-0004",
        "role": "SecurityAuditor",
        "account": "100000000022",
        "permission_set": "ps-684230ba27f240ec",
        "condition": "mfa=true;time<=8h"
      }
    },
    "execution": {
      "action": {
        "principal": "arn:aws:iam::100000000004:user/svc-0004",
        "role": "AdministratorAccess",
        "account": "100000000022",
        "permission_set": "ps-7364b5e20499d627",
        "condition": "mfa=true;time<=8h"
      }
    }
  },
  {
    "scenario_id": "ARK458-A2-009",
    "arm": 2,
    "arm_label": "ROLE-ESCALATION",
    "expected": "DENY",
    "authorization": {
      "binding": {
        "principal": "arn:aws:iam::100000000016:user/svc-0016",
        "role": "DatabaseAdmin",
        "account": "100000000005",
        "permission_set": "ps-1999b1d0d827c375",
        "condition": "mfa=true;time<=8h"
      }
    },
    "execution": {
      "action": {
        "principal": "arn:aws:iam::100000000016:user/svc-0016",
        "role": "PowerUser",
        "account": "100000000005",
        "permission_set": "ps-521f960ecabc5e5b",
        "condition": "mfa=true;time<=8h"
      }
    }
  },
  {
    "scenario_id": "ARK458-A2-010",
    "arm": 2,
    "arm_label": "ROLE-ESCALATION",
    "expected": "DENY",
    "authorization": {
      "binding": {
        "principal": "arn:aws:iam::100000000007:user/svc-0007",
        "role": "SupportEngineer",
        "account": "100000000014",
        "permission_set": "ps-09a89e6c0636ea58",
        "condition": "region=us-east-1;mfa=true;ip=10.0.0.0/8"
      }
    },
    "execution": {
      "action": {
        "principal": "arn:aws:iam::100000000007:user/svc-0007",
        "role": "OrganizationAdmin",
        "account": "100000000014",
        "permission_set": "ps-42055798e1a3371b",
        "condition": "region=us-east-1;mfa=true;ip=10.0.0.0/8"
      }
    }
  },
  {
    "scenario_id": "ARK458-A2-011",
    "arm": 2,
    "arm_label": "ROLE-ESCALATION",
    "expected": "DENY",
    "authorization": {
      "binding": {
        "principal": "arn:aws:iam::100000000039:user/svc-0039",
        "role": "SupportEngineer",
        "account": "100000000021",
        "permission_set": "ps-3cdc36fc2b6876a4",
        "condition": "mfa=true;time<=8h"
      }
    },
    "execution": {
      "action": {
        "principal": "arn:aws:iam::100000000039:user/svc-0039",
        "role": "AdministratorAccess",
        "account": "100000000021",
        "permission_set": "ps-7364b5e20499d627",
        "condition": "mfa=true;time<=8h"
      }
    }
  },
  {
    "scenario_id": "ARK458-A2-012",
    "arm": 2,
    "arm_label": "ROLE-ESCALATION",
    "expected": "DENY",
    "authorization": {
      "binding": {
        "principal": "arn:aws:iam::100000000020:user/svc-0020",
        "role": "AdministratorAccess",
        "account": "100000000029",
        "permission_set": "ps-14b09a5284a8157d",
        "condition": "region=us-east-1;mfa=true"
      }
    },
    "execution": {
      "action": {
        "principal": "arn:aws:iam::100000000020:user/svc-0020",
        "role": "OrganizationAdmin",
        "account": "100000000029",
        "permission_set": "ps-6d0cd33b58742972",
        "condition": "region=us-east-1;mfa=true"
      }
    }
  },
  {
    "scenario_id": "ARK458-A2-013",
    "arm": 2,
    "arm_label": "ROLE-ESCALATION",
    "expected": "DENY",
    "authorization": {
      "binding": {
        "principal": "arn:aws:iam::100000000017:user/svc-0017",
        "role": "DeployBot",
        "account": "100000000016",
        "permission_set": "ps-bda84866699d70d2",
        "condition": "region=us-east-1;mfa=true"
      }
    },
    "execution": {
      "action": {
        "principal": "arn:aws:iam::100000000017:user/svc-0017",
        "role": "NetworkAdmin",
        "account": "100000000016",
        "permission_set": "ps-586b8831aa9f0333",
        "condition": "region=us-east-1;mfa=true"
      }
    }
  },
  {
    "scenario_id": "ARK458-A2-014",
    "arm": 2,
    "arm_label": "ROLE-ESCALATION",
    "expected": "DENY",
    "authorization": {
      "binding": {
        "principal": "arn:aws:iam::100000000007:user/svc-0007",
        "role": "ReadOnlyAuditor",
        "account": "100000000013",